{
  "$schema": "urn:golfergeek:schema:apple-divinr-fixtures:v0.2",
  "schemaVersion": 2,
  "canonicalization": "RFC8785",
  "hash": "SHA-256 base64url without padding",
  "positive": [
    {
      "fixtureId": "analysis-request-positive-v1",
      "schemaRef": "urn:golfergeek:schema:apple-divinr-integration:v0.2#/$defs/analysisRequest",
      "value": {
        "analysisTypes": ["direction", "risk"],
        "asOf": "2026-07-22T18:00:00Z",
        "horizon": "1w",
        "idempotencyKey": "idem-analysis-demo-001",
        "instrumentId": "340d4312-0000-4000-8000-000000000001",
        "requestId": "req-analysis-demo-001",
        "schemaVersion": 2
      },
      "canonicalSha256": "mVQ9siBjfTYkflYNfKoyDmkXUMwLd3TXM_CrofLiEj4"
    },
    {
      "fixtureId": "general-updates-request-positive-v2",
      "schemaRef": "urn:golfergeek:schema:apple-divinr-integration:v0.2#/$defs/updatesRequest",
      "value": {"categories": ["platform", "analysis"], "idempotencyKey": "idem-general-updates-001", "pageSize": 10, "requestId": "req-general-updates-001", "schemaVersion": 2},
      "canonicalSha256": "W-zpfBRQmzgMXuANcqM4CTqC1mVE5LCTMAc9YO1bWLg"
    },
    {
      "fixtureId": "personal-updates-request-positive-v2",
      "schemaRef": "urn:golfergeek:schema:apple-divinr-integration:v0.2#/$defs/updatesRequest",
      "value": {"categories": ["portfolio", "tournament"], "idempotencyKey": "idem-personal-updates-001", "pageSize": 10, "requestId": "req-personal-updates-001", "schemaVersion": 2, "since": "2026-07-22T18:00:00Z"},
      "canonicalSha256": "T3IunUN-ytmi1NruNvkO-yOJcp0feb0AWkphutEQIPY"
    },
    {
      "fixtureId": "tournaments-list-request-positive-v2",
      "schemaRef": "urn:golfergeek:schema:apple-divinr-integration:v0.2#/$defs/tournamentsListRequest",
      "value": {"idempotencyKey": "idem-tournaments-list-001", "pageSize": 10, "requestId": "req-tournaments-list-001", "schemaVersion": 2, "status": "all"},
      "canonicalSha256": "k_IxquzYfP-URb9CLFMKCwHkerL6LwHwBG-ayIBaro4"
    },
    {
      "fixtureId": "tournament-context-request-positive-v2",
      "schemaRef": "urn:golfergeek:schema:apple-divinr-integration:v0.2#/$defs/tournamentContextRequest",
      "value": {"idempotencyKey": "idem-tournament-context-001", "requestId": "req-tournament-context-001", "schemaVersion": 2, "tournamentId": "tournament-demo-001"},
      "canonicalSha256": "B_Fu9HTlm0BiM5SvuO82hO6QQf4u4qFRdZEXcs2hVwA"
    },
    {
      "fixtureId": "tournament-join-request-positive-v2",
      "schemaRef": "urn:golfergeek:schema:apple-divinr-integration:v0.2#/$defs/tournamentJoinRequest",
      "value": {"idempotencyKey": "idem-tournament-join-001", "ownerApprovalId": "approval-tournament-join-001", "requestId": "req-tournament-join-001", "schemaVersion": 2, "tournamentId": "tournament-demo-001"},
      "canonicalSha256": "cAN8uYeuFjz2zPBSzeqH-7JcKJkww-MsWpn66OoiAVw"
    },
    {
      "fixtureId": "product-general-updates-positive-v2",
      "schemaRef": "urn:golfergeek:schema:apple-divinr-integration:v0.2#/$defs/productBinding",
      "value": {"atomicAmount": "10000", "priceMinorUnits": 1, "productId": "divinr.general-updates.demo.v2", "skillId": "general_updates"},
      "canonicalSha256": "n2Qa5zj9-TPCKu2TXlP17W3hREjeMDf-Y5WTurIEaug"
    },
    {
      "fixtureId": "product-personal-updates-positive-v2",
      "schemaRef": "urn:golfergeek:schema:apple-divinr-integration:v0.2#/$defs/productBinding",
      "value": {"atomicAmount": "20000", "priceMinorUnits": 2, "productId": "divinr.personal-updates.demo.v2", "skillId": "personal_updates"},
      "canonicalSha256": "UtxhzuuptRBpkakKKN83_DRYmemfDwupjoJUpvkaNws"
    },
    {
      "fixtureId": "product-tournaments-list-positive-v2",
      "schemaRef": "urn:golfergeek:schema:apple-divinr-integration:v0.2#/$defs/productBinding",
      "value": {"atomicAmount": "10000", "priceMinorUnits": 1, "productId": "divinr.tournaments-list.demo.v2", "skillId": "tournaments_list"},
      "canonicalSha256": "zQTyHCOEqeVpBSU2F0KAyV_OMOR0BjxZxOGiS2_eOhQ"
    },
    {
      "fixtureId": "product-tournament-context-positive-v2",
      "schemaRef": "urn:golfergeek:schema:apple-divinr-integration:v0.2#/$defs/productBinding",
      "value": {"atomicAmount": "20000", "priceMinorUnits": 2, "productId": "divinr.tournament-context.demo.v2", "skillId": "tournament_context"},
      "canonicalSha256": "5IGHGR2BrIj0ogNOzADzhxWW7ZsCYRDUCIYRferJsyQ"
    },
    {
      "fixtureId": "product-analysis-positive-v2",
      "schemaRef": "urn:golfergeek:schema:apple-divinr-integration:v0.2#/$defs/productBinding",
      "value": {"atomicAmount": "50000", "priceMinorUnits": 5, "productId": "divinr.analysis.demo.v2", "skillId": "analysis_request"},
      "canonicalSha256": "kqR2w5CL48jHX_INpYm3Bkx_SfQgxXnEnIVk1jSlDTk"
    },
    {
      "fixtureId": "product-tournament-join-positive-v2",
      "schemaRef": "urn:golfergeek:schema:apple-divinr-integration:v0.2#/$defs/productBinding",
      "value": {"atomicAmount": "30000", "priceMinorUnits": 3, "productId": "divinr.tournament-join.demo.v2", "skillId": "tournament_join"},
      "canonicalSha256": "uRwtxUayl2BoouOIM7yyFvYGOQCiG2-uciiGxrIMnWQ"
    },
    {
      "fixtureId": "product-tournament-trade-positive-v2",
      "schemaRef": "urn:golfergeek:schema:apple-divinr-integration:v0.2#/$defs/productBinding",
      "value": {"atomicAmount": "40000", "priceMinorUnits": 4, "productId": "divinr.tournament-trade.demo.v2", "skillId": "tournament_trade"},
      "canonicalSha256": "E4CAf5l8fq7VZzCYfDLRMLW-hxruL9MvpMLwTyzHw5w"
    },
    {
      "fixtureId": "merchant-constraint-positive-v1",
      "schemaRef": "urn:golfergeek:schema:apple-divinr-integration:v0.2#/$defs/constraint",
      "value": {
        "constraint_id": "con-merchant-demo-001",
        "critical": true,
        "issuer": "owner",
        "namespace": "urn:golfergeek:agent-commerce:constraints:v0.2",
        "scope": "checkout",
        "subject": "apple-installation-demo-001",
        "type": "merchant.allow",
        "value": {
          "merchant_ids": ["divinr"]
        },
        "version": 1
      },
      "canonicalSha256": "nJw5aPeecX-gQQ6isMY9TN0rKC4jKw148vvq47tfkGc"
    },
    {
      "fixtureId": "payment-limit-positive-v1",
      "schemaRef": "urn:golfergeek:schema:apple-divinr-integration:v0.2#/$defs/constraint",
      "value": {
        "constraint_id": "con-payment-limit-demo-001",
        "critical": true,
        "issuer": "owner",
        "namespace": "urn:golfergeek:agent-commerce:constraints:v0.2",
        "scope": "payment",
        "subject": "apple-installation-demo-001",
        "type": "amount.max_per_transaction",
        "value": {
          "asset": "BTC-REGTEST",
          "atomic_amount": "50000",
          "unit": "msat"
        },
        "version": 1
      },
      "canonicalSha256": "RCWURR4T4KvzmTn4r3O1KDFj1V87Z_AdFTxJQs4k2lM"
    },
    {
      "fixtureId": "tournament-trade-positive-v1",
      "schemaRef": "urn:golfergeek:schema:apple-divinr-integration:v0.2#/$defs/tournamentTradeRequest",
      "value": {
        "analysisArtifactId": "artifact-analysis-demo-001",
        "analysisArtifactHash": "AAAAAAAAAAAAAAAAAAAAAAAAAAAAAAAAAAAAAAAAAAA",
        "direction": "long",
        "idempotencyKey": "idem-tournament-demo-001",
        "instrumentId": "340d4312-0000-4000-8000-000000000001",
        "symbol": "AAPL",
        "ownerApprovalId": "approval-tournament-demo-001",
        "requestId": "req-tournament-demo-001",
        "schemaVersion": 2,
        "tournamentId": "tournament-demo-001",
        "quantity": 1
      },
      "canonicalSha256": "8SZ1Hvz9q5oow7zLelKkBL0KED8ARUFKpHa03VwXB3U"
    },
    {
      "fixtureId": "ap2-constraint-set-positive-v1",
      "schemaRef": "urn:golfergeek:schema:apple-divinr-integration:v0.2#/$defs/ap2ConstraintSet",
      "value": {
        "constraints": [
          {
            "constraint_id": "con-agent-demo-001",
            "critical": true,
            "issuer": "owner",
            "namespace": "urn:golfergeek:agent-commerce:constraints:v0.2",
            "scope": "checkout/payment",
            "subject": "apple-installation-demo-001",
            "type": "agent.bind",
            "value": {"dpop_jkt": "AAAAAAAAAAAAAAAAAAAAAAAAAAAAAAAAAAAAAAAAAAA", "installation_id": "apple-installation-demo-001"},
            "version": 1
          },
          {
            "constraint_id": "con-amount-cumulative-demo-001",
            "critical": true,
            "issuer": "owner",
            "namespace": "urn:golfergeek:agent-commerce:constraints:v0.2",
            "scope": "checkout/payment",
            "subject": "apple-installation-demo-001",
            "type": "amount.max_cumulative",
            "value": {"asset": "BTC-REGTEST", "atomic_amount": "250000", "counter_id": "counter-amount-demo-001", "unit": "msat", "window_end": "2026-07-22T19:00:00Z", "window_start": "2026-07-22T18:00:00Z"},
            "version": 1
          },
          {
            "constraint_id": "con-asset-demo-001",
            "critical": true,
            "issuer": "owner",
            "namespace": "urn:golfergeek:agent-commerce:constraints:v0.2",
            "scope": "payment",
            "subject": "apple-installation-demo-001",
            "type": "payment.asset.allow",
            "value": {"assets": ["BTC-REGTEST"]},
            "version": 1
          },
          {
            "constraint_id": "con-count-cumulative-demo-001",
            "critical": true,
            "issuer": "owner",
            "namespace": "urn:golfergeek:agent-commerce:constraints:v0.2",
            "scope": "checkout/payment",
            "subject": "apple-installation-demo-001",
            "type": "count.max_cumulative",
            "value": {"counter_id": "counter-count-demo-001", "max_count": 10, "window_end": "2026-07-22T19:00:00Z", "window_start": "2026-07-22T18:00:00Z"},
            "version": 1
          },
          {
            "constraint_id": "con-merchant-demo-001",